{
  "gate_type": "actor-execution-gate",
  "gate_format_version": 1,
  "recorded_at": "2026-08-14T01:43:35.000Z",
  "gate_id": "AEG-TASK-134-BUILDER",
  "actor_assignment_evaluation_ref": ".aof/artifacts/actor-assignment-evaluations/AAE-TASK-134-BUILDER.json",
  "actor_skill_packet_ref": ".aof/artifacts/actor-skill-packets/ASP-TASK-134-BUILDER.json",
  "source_task_id": "TASK-134",
  "source_parent_session_id": "SESS-V113-PROVIDER-READ-INTEGRATION",
  "source_decision_record_id": null,
  "assignment": {"actor_ref": "codex", "role_ref": "builder", "team_ref": "runtime-team", "execution_mode": "single-actor", "assignment_state": "selected"},
  "resource_gate": {"state": "allowed", "required_resource_refs": ["resource-repo-main"], "claim_refs": [".aof/artifacts/allocation/resource-claims/RCL-TASK-129-REPO-MAIN.json"], "missing_resource_refs": [], "claim_summaries": [{"artifact_ref": ".aof/artifacts/allocation/resource-claims/RCL-TASK-129-REPO-MAIN.json", "resource_ref": "resource-repo-main", "claim_status": "approved", "claimant_role_ref": "builder"}]},
  "policy_gate": {"state": "allowed", "required_policy_refs": ["policy-runtime-backed-answer-discipline"], "evaluation_refs": [".aof/artifacts/allocation/policy-evaluations/PER-TASK-129-RUNTIME-DISCIPLINE.json"], "missing_policy_refs": [], "evaluation_summaries": [{"artifact_ref": ".aof/artifacts/allocation/policy-evaluations/PER-TASK-129-RUNTIME-DISCIPLINE.json", "policy_refs": ["policy-runtime-backed-answer-discipline"], "overall_outcome": "allowed"}]},
  "gate_decision": {"execution_gate_state": "allowed", "rationale": "Assignment, resource claims, and policy evaluations are explicit and non-blocking.", "recommended_action": "Proceed to governed actor execution."},
  "hri_projection": {"character_label": "Builder", "speech_bubble": "I can implement the validation replay audit under local project-write authority.", "current_action": "Implement v11.3 runtime surface", "visible_state": "allowed", "visible_blockers": [], "next_action": "Submit role result."}
}
