{
  "gate_type": "actor-execution-gate",
  "gate_format_version": 1,
  "recorded_at": "2026-08-05T14:01:00.727Z",
  "gate_id": "AEG-TASK-127-builder",
  "actor_assignment_evaluation_ref": ".aof/artifacts/actor-assignment-evaluations/AAE-TASK-127-builder.json",
  "actor_skill_packet_ref": ".aof/artifacts/actor-skill-packets/ASP-TASK-127-builder.json",
  "source_task_id": "TASK-127",
  "source_parent_session_id": "SESS-V107-CAPABILITY-COVERAGE-GATE",
  "source_decision_record_id": null,
  "assignment": {
    "actor_ref": "codex",
    "role_ref": "builder",
    "team_ref": "runtime-team",
    "execution_mode": "single-actor",
    "assignment_state": "selected"
  },
  "resource_gate": {
    "state": "allowed",
    "required_resource_refs": [],
    "claim_refs": [],
    "missing_resource_refs": [],
    "claim_summaries": []
  },
  "policy_gate": {
    "state": "allowed",
    "required_policy_refs": [],
    "evaluation_refs": [],
    "missing_policy_refs": [],
    "evaluation_summaries": []
  },
  "gate_decision": {
    "execution_gate_state": "allowed",
    "rationale": "Assignment, resource claims, and policy evaluations are explicit and non-blocking.",
    "recommended_action": "Proceed to governed actor execution."
  },
  "hri_projection": {
    "character_label": "builder",
    "speech_bubble": "Resources and policies are explicit; I can execute under the gate.",
    "current_action": "Implement coverage audit and CLI integration.",
    "visible_state": "allowed",
    "visible_blockers": [],
    "next_action": "Proceed to governed actor execution."
  }
}
